---
source: src/descriptor.rs
expression: descriptor_dump(&desc)
---
R: 292 05 0d 09 01 a1 01 85 08 09 20 a1 00 15 00 25 01 75 01 09 42 09 44 09 5a 95 03 81 02 95 04 81 01 09 32 95 01 81 02 75 18 95 01 a4 05 01 65 13 55 0d 17 00 00 00 00 27 70 c6 00 00 37 00 00 00 00 47 10 27 00 00 09 30 81 02 17 00 00 00 00 27 06 7c 00 00 37 00 00 00 00 47 6a 18 00 00 09 31 81 02 b4 16 00 00 26 ff 1f 09 30 75 10 95 01 81 02 75 08 95 02 a4 65 14 55 00 15 c4 35 c4 25 3c 45 3c 09 3d 09 3e 81 02 b4 c0 c0 05 01 09 07 a1 01 85 03 15 00 25 01 05 0d 09 39 a1 00 09 44 95 01 75 01 81 02 95 07 81 01 05 01 09 30 09 31 95 02 75 08 81 02 c0 05 09 19 01 29 0a 95 0a 75 01 81 02 05 01 09 05 a1 01 05 09 19 01 29 03 95 03 81 02 c0 95 33 81 01 c0 05 01 09 07 a1 01 85 f0 15 00 25 01 05 0d 09 39 a1 00 05 09 09 01 95 01 75 01 81 02 95 07 81 01 05 01 09 30 09 31 75 08 95 02 81 02 95 01 81 01 05 01 09 38 95 01 15 ff 25 01 81 06 05 0c 0a 38 02 95 01 81 06 c0 75 08 95 05 81 01 c0
